,comment_id,comments,reply
0,h02cjsf,you might not like my advice but you might benefit from a therapist. i think now there are a shit ton of online therapists. so that'll make it easier on you. good luck,||
1,h02cg0j,making genuine friends is hard for sure.,||
2,h02cdzb,"yeah i can relate to you very well. I used to have really bad social anxiety in the past. it takes a shit ton of patience and practice to learn to be 'social'. trust me, everyone struggles at one level or another. do you work out? start working out. therapy also helps. maybe seek out a therapist who specializes in social anxiety?(or someone who can guide you on xyz). i also recommend listen to youtube audiobooks on 'stoicism' to me at least has helped lower my Anxiety about overthinking stuff. i hope i helped a bit. in reality, you have to work on your whole you and it will take a shit ton of work. but as long as you keep at it, you'll be happier with who you are. also celebrate every tiny progress you made each day. take care",
3,h02cawo,They are blind... I feel your pain. I wad laught at as well fitst months at school. They just dont see your inside.,||
4,h02c9w0,Yes you're good. You're far from real despair... Best of luck," with your next adventure, and be safe!||"
5,h02c1aw,I'd reply something helpful but I'm too unmotivated to do," anything, so it's a bit of a mystery what to write about this week.    It's been an amazing week for the Boston Red Sox, and I hope we all can be as excited for next season as I am for the coming one. So... let me know if there #39;s anything I can do to help||"
6,h02bzin,"ty for the advice!! as for them being grateful knowing I'm back, I have not yet said anything so they don't know I'm here :(",||
7,h02bwkt,"About the get to talk to them problem: Just greet them and tell them what you want and feel and how hard it is for you to do the first step. It sounds like they are more grateful to know u r back and that you want it to stay that way than to know what happened. 

And about the issue with the reasoning: If you cant talk about the reason right now tell them how u feel and ask for some time to figure it out. Maby ask them about how they felt and what they we're thinking if it does not pull u down. If it does tell them that it would not be good for your mental health to talk about what happened right now and ask them to wait for the time when u feel ready. 

Maby its not the fastest way to clear the air but for me it sounds like the most selfcared way.",
8,h02btkh,well you got a few more years but maybe once you’re out of school you can try it just for a summer. you can meet people who think in the same realm as you with similar interests. there are genuine people out there but i’ll tell you from my experience i certainly didn’t find them in high school. i hope things start looking up for you , #151;||
9,h02bntv,I mean like everybody deserves somebody. Its not like you are different from anybody else,", you just have to work hard and do the best that you can.||"
10,h02bnqv,that's not helpful," to Apple when it comes to the next generation of the iPod, as some have claimed.||"
11,h02bmue,That's great I hope you'll have a good time!,||
12,h02bmge,jesus man fuck whoever it was that told you to do that shit,", I hope he got a medal and a life sentence for it||"
13,h02bkpm,"You'll get there, to the point where you're like ""whoa, I'm pretty awesome! if only I knew that when I was 23, those were difficult years of figuring out stuff"".

Sounds like you have good relationship with your mom. In such a way that if you did ask her ""am I disappointment? she'd likely be sad that the thought have crossed your mind""

If you have everything figured out before age 25. You're beyond superstar, not many do. The 'statistics' don't matter. Perception does.

You may see a lot of people going to college, and finding jobs and so on, and it 'seems' like they have it figured out. Some might have, but rarely. Most are figuring it out just like you are. And they're super stressed about it too.

Rarely do college student graduate and think ""well, now time to start my job, and figure out life"". College is just an extension of high-school in sense of 'reality'. Grad school can be more difficult and require more responsibility, sure.

But a grad student have no experience (if they never worked before) when compared to a minimum wage worker of 4 years, whom have more perceptible reality to what life is actually like after schooling.

You're smart. People may say otherwise, for whatever reason they may need to. But you're smart. Every child is smart, every student is smart. It's only when they're not trying that it's quite a miss opportunity.

If you earnestly tried very hard, and are continuing to give your best effort when you can, you're smart, and most of us are rooting for you to make it through these tough years of self-discovery.

There is nothing gained from putting other people down based on standards. Everyone have their own unique set of passionate skills which they will develop. Whether it's helping people, whether it's making machinery, whether it's preserving wildlife, etc etc. Most people in life, really wants to find this 'passion'. But some don't find it until their late 40s.

My college years were 'mehs'. I thought it was quite boring, and I was quite delusional regarding ""if I don't graduate college, I'm going to be a failure forever"". But then I saw the silly people whom were in classes with me, and I thought, maybe I'll be alright... or at least... I don't think I belong here...  My academics were 'stellars', but my heart wasn't in it.

It's not for everyone. Don't get me wrong, if a person desires to be an engineer, it's likely college or some form of learning will be for them. However, the way 'college' are set up, especially the book prices which gets renew every other year because MONEY. It makes no sense to me. The cost of education is 'so high', and I don't mean just money. You're buying into a perception. A perception that everyone needs to pass college or they will amount to little.

The 'truth' is, or in least, my personal truth is that personality and individual knowledge are 'more essential'. Meaning, everyone can go to college to learn how molecules interact with one another and so on. But how is that useful if the person themselves lack healthy perception of the world?

You sound like you're going through a tough time. It will get better, most likely anyway.  
Some support would go a long way if you're stressed out a lot though.

Talk to your trust ones, like your mom, unless she's really stress right now too or something.

Usually, our parents really want to be there for us. and even if they don't give any good advice, it's quite comforting to just talk to someone about what you're thinking about and the surmount of pressure you're feeling.

At the end of the day, do you like you? Do you enjoy being with yourself and so on. If right now you're thinking ""no, I'm ugly, I'm a disappointment, etc etc"". No one can change your thoughts in way.

But there was a time when you thought ""I'm so awesome! I'm a super star!"" until others and the world came around and knocked you down with 'standards'.

The standards are just too high, if everyone can somehow met them, we'd all be 'well educated'.

A good healthy standard to go by is

""did you earnestly put in hard work today?""  
If not, that can be alright if you need some time to just relax, and get the stress level down before you're back on the horse. Just don't be one of those lazy millennial whom believes money and success will fall into their laps by making a few youtube videos.

""did you treat yourself kindly today?""

It can be healthy to self-criticize like ""I could have done better at this, or I've made a mistake here"". but everyone makes mistakes in way. Did you genuinely make a mistake and feel bad and know what to do next time? if so, perhaps it's time to stop feeling so bad about just being a regular human going through their early twenties.

""did you treat others kindly today?""

Forget college degrees and so on. This fundamental 'healthy standard' should be the hallmark. But there's so much ego in academia, there's so much ego in the workplace and so on.

If you're worried about if you're going to be a productive, healthy individual amongst society one day or not. It's likely you'll get there. But it's going to be way more difficult if you're stressed over things that 'don't truly even matter'.

They only appear to matter because young students are drilled with the idea of ""you want to be smart and successful and not a loser and not make everyone think lowly of you? graduate college now! don't' forget to buy all our expensive book that can't ever be recused after two years because we keep printing new one because capitalism! (Hint, buy used book off amazon. The best professors wouldn't require student to have their textbook anyway, if a professor SPECFICALLY calls someone out for not having 'their brand new textbook' it's such a red flag.)

I've realize within my second year that I didn't need any text book >.> the professor did their job well enough in which I just wrote down notes in class. what a college hack. don't buy book, save it for grocery.",
14,h02bk0g,im not but its something i think i want and i think will make me happy. but i truly don’t think i being with anyone or deserve anyone. i’ve come to terms with that but i still wish.,||
15,h02bjz9,Sucks and I haven't found a way to self motivate, since the start of the season. It #39;s almost time to move on.||
16,h02biv3,"Psychotic episodes are usually a symptom of an underlying disease, most commonly schizophrenia, but other diseases can have them as well. So you should try to find out what the underlying disease is in your case (with the help of your therapist and doctors). Is there any history of schizophrenia or something like that in your family?

I haven't had any psychotic symptoms myself, but I've been to the psych ward and met some schizophrenic patients there. The stories are quite unique, but it seems really common to feel like things just have to be a certain way or that you know a deeper truth that nobody else can see. The aggression and feces on walls or other places they shouldn't be are sadly also quite common.

You have a therapist, and a doctor to prescribe you the necessary meds, that's a good place to start. You could ask them to explain in more details what psychosis really means. Or, if you want to explore more on your own without feeling pressured to share more details, you can ask them for book recommendations.

Your life certainly changes a lot now because you will always have to stay on the meds and you know what psychosis can do to a person. But it's not necessarily ruined. You can find new priorities, new hobbies and a new purpose for yourself. It may be different from what you expected, but that happens to a hell of a lot of people who have life ""ruining"" (or better: changing) experiences. You may have a bad disease that keeps you from being the person you thought you would be, but you have yet to get to know the person you can become now.

(Since you seem to like journaling and have unique experiences, you could even consider writing books about your experiences. A book from a psychotic patient's perspective could be really helpful to future patients, their loved ones, therapists and doctors. But that's just a thought, it's probably too early to think about that for you.)",
17,h02bgoc,But how can you be sure a relationship can make you happy,?||
18,h02bfim,"The only way forward is through...once the mental landscape changes the reality around you will eventually change, You dedice what you see in this movie or dream that we call life. It's hard pill to swallow...I know I'm still in the process myself and I sometimes wake up wishing I had; but this is the game we accepted. Reconnect with your spirituality, it's the only thing that can assist you. The work will always come from within no one will do it for us. Take care",
19,h02bdx4,Amen to that.,||
20,h02ba52,"I apologise, I didn't realise you were still young. You'll be ok, but I think you need to get used to doing life admin. 
Honestly once you start taking care of the little things, you'll feel more able to tackle the big things. You can do it, it just takes a bit of practice. Good luck to you!",||
21,h02b6h5,I'm 25 I feel so burnout already,". I've been working on a lot of things over the last few months, including:||"
22,h02b20d,I’m only 17… I’m still in high school I think it would become too much for my family," to bear, but that #39;s what it took. I was so young and just starting to learn how to play basketball.   The game changed everything for me, and now I'm ready to take it all the way home.||"
23,h02b190,"Hmm well everyone is different. It's been some years since I realised there's no meaning to it all, and I haven't craved any meaning ever since, or wished there was one. I think so many things depend on your perspective and how you look at things, maybe for some people meaning is essential but for others it's not.

What kind of meaning do you crave? Maybe you can find or think of your own one. I have a friend who doesn't believe in higher powers or meaning or anything like that. However, he has always wanted to become a scientist, and he's a bioinformatitian in a cancer research lab now. He's found his meaning/purpose in his work.",
24,h02ax6b,"You're probably feeling shitty because you've gone 4 days with no meds? 
Okay well if you're that mentally ill that you can't do simple tasks then I feel really sorry for you. Maybe you should ask if you can get a support worker?",  #39;||
25,h02ax45,"Man, this hits home.", I #39;ve been a huge supporter of Microsoft for a while and I can't wait for Windows 10 to be available to everyone.||
26,h02asbk,"Hey, just wanted to check in and see if you had anyone reach out to you. If not, or if you'd like to talk to another person, I'm also 19 M and would be happy to talk.", Thanks! -Mike||
27,h02aoal,"Yeah obviously I took my script straight to the chemist after I got it but I ran out and have to get more, and I must’ve misplaced it? I know it’s my own fault but like I still wanted to let my feelings out? It’s kinda hard to ‘start organising my life’ when my mental illnesses literally stop me from doing that",. So yeah thank you so much. You did an amazing job with what you did. And thank you||
28,h02anox,"I know this sounds like a complete and utter mambo jumbo bullshit and it makes me roll my eyes, too.

But, what if you actually, just for yourself, wrote down the absolute opposites of this. And you did that every day for some time. It doesn't actually matter that you don't believe it and that it makes you cringe and a little angry even. It still works, slowly but surely.

\---

I will be happy. I am fucking happy!

I am satisfied with myself. And I will be more and more.

People love me. And I'll work on it so there's more love in the world.

I am can have love and happiness, every day. Just as the next guy.

//Deserving something does not mean you'll get it.

\- Just don't say that. Replace this with something else. Like - I will work every day towards my goals. Even a tiny little bit.

Good things happen, TO EVERYONE. I'm no special snowflake.

//I do not deserve this suffering, and suicide is the only way I have to take matters into my own hands.

I have suffered and have won. I will always win. I will always fight. And it will become easier and easier. Until I'm a master slayer.

\---

I'd do this in your own words for a couple of days, or as long as you can go.

Doing affirmations like this has helped me incredibly. It just did and I can swear, it at least won't do any damage. Your brain (anyone's) is not that smart. He won't know that you're lying to him when you're thinking  ""Jesus I'm so happy! How did I even become this happy? I don't know! But I am!"" Sure it doesn't work instantaneously, but actually faster than I thought.

I really have found that even when I say these positive things sarcastically, they still kinda sorta work.

Sorry to have annoyed you with my bullcrap ""wisdom"". It is just something that helps me.

&#x200B;

//edit: Even if you don't do this, I beg you, to at least not think the things you wrote. Not too often and definitely don't indulge in it. The affirmations really work, both ways. These things very easily become reality if you think of them too often.",
29,h02ajmy,"From personal experience, relationships usually don't make you happy in the long run. If you're in a bad state by yourself, this will affect your relationship negatively. Another thing is that relationships for the most part don't end in marriage. Especially if it's your first. If you're not doing well by yourself, get into a relationship, and then break up, you'll inevitably feel lower than before the relationship began.

You usually have to learn to be happy by yourself before you can have a healthy relationship.",
30,h02ahmb,"How can you lose a script?? Surely you get it from the doctors then go straight to the pharmacy?? 

You need to start organising your life mate because this is no one else's fault but your own. 

Ring the doctors and let them know you need another script ASAP.",||
31,h02afyc,"The US, this happened here in California. Bay Area", residents and visitors alike took advantage of the city's unique setting and created an unforgettable evening for all ages.||
32,h02a9j3,If only I didn't have kids. I think about this often.," When I'm at work and in my car, I look out for each other and try to be a father to my kids.||"
33,h02a8ve,People of various disabilities have done amazing things in life.  Grab some books that tell of these people as they will give you hope.,||
34,h02a76i,"I sought professional help, but they told me i wasn't depressed because i could get up and hold down a job.

Working on yourself is what people who have never not had someone in their lives say because they think it so fucking easy.

Until they go 20+ years without a single kiss or cuddle and see how fucking able they are to love themselves out of depression.

Buuuut you cant say that to people because they get stroppy and say ""I've been alone plenty - I loved myself and now I have a loving wife/husband"" or ""how dare you say we haven't suffered""

bleh, doesn't really matter what they say tbh - nothings gonna change anything - exercise, healthy eating, self love - all of it won't change the simple fact that no one wants me.

You guys ain't alone.",
35,h02a50i,"Maybe try pomodoro technique? Or just try to focus for 30 minutes and then have a short break. And repeat. 
I also have problems with focus and I always read everything at once and then I'm overwhelmed by the amount of work. 
 It sucks but we need to get through this.",||
36,h02a4s0,I am scared. I choose by least scary," to be a human. I choose by the most dangerous to be a robot, and I choose for the sake of humanity.||"
37,h02a4no,"If u have to bite your tongue around them that means they're doing shit u don't agree with, in my experiences it's better to be open and honest maybe things don't end the way you want but at least you got your absolutely VALID feelings across. A lot of guys find that extremely attractive btw I've got faith in u friend :)",||
38,h02a42n,"I can so relate. I am feeling so alone in my life, yet I find it so hard to make real friends. And when I do, I find they often dont reply my messages, or dont seem to reciprocate being caring and considerate towards me, as well as I am of  them. Inside I feel so sad. I feel like no one in my life is on my team, or really cares about me. I am a single mum, my son has asbergers, and so doesnt express love and empathy like others. His dad bailed on us, and isnt interested or in contact anymore. I moved to be closer to my family, yet they would never visit me. It is all one sided in my life. It just compounds my innner feeling of worthlessness, that noone can love or care about me. Thinking perhaps I should talk to a therapist. 
I am just tired of feeling so alone, and that life is hard and noone cares. I am sorry, for blabbering on. Thankyou for reading, and I hope things improve for you. Tomorrows a new day hey!",
39,h02a3p4,"well for me, it just seems like it makes you happy. and im not sure when the last time i was truly happy. and society makes relationships seem like the holy grail.",||
40,h02a1e0,"No, you want to be you. you are around people who expect you not to be. I'm sorry your sister wasn't good to you. but you can't let people like her drag you down. embrace who you are.  prioritize yourself and meet your own goals. we don't have enough time in this life to maintain a false image of ourselves. fuck what other people think. you're not weak. you're resilient. you've endured a lot, just don't take it on yourself. you're great the way you are, the care you have for your sister is wonderful. it's sad she doesn't see that right now. but someone will soon enough. just keep going, I believe in you",
41,h029z5j,I'm in the same boat. Busted ass for the last 6 Months to secure a payrise and a bonus only to be told in my review last week that my payrise will be given in the next quarter and they have decided not to go with the bonus'. I have 2 kids and another on the way and I was really counting on that extra income. Now I feel like I can't provide for my family no matter how hard I work. I just don't see the point if people aren't going to hold up their end of the deal. I thought hard work pays off? Apparently not. I actually enjoyed my job for a while until this. I want to start my own business but my credit is crap and I have no savings. I just wish I could quit but I can't.,
42,h029yaa,please don't. please., do. not.||
43,h029rjz,"yes. I describe how I feel as there's two ""me's"" happening at once. the depressed brain is watching my body enjoy existence. it feels separate. I can go for a walk and logically understand my beautiful surroundings but the depression does not allow me to enjoy it.",||
44,h029pd1,Why does everybody want to be in a relationship?,||
45,h029htm,"oh my! this is exactly what I was thinking for the longest time!

""I'm smart enough to want to understand everything but too dumb to understand it."" So I always analyze everything and go for the seemingly best choice aaaand it's wrong. 

I actually think the key is not doing that. Of course, you should use your brain to look for ways out. BUT people lately seem to think that meditation and psychedelics help depression tremendously. And both of those are in the essence - don't think anything, don't try to control anything, just trust the process and let the brain heal itself.",
46,h0299o7,*hugs back*, and a happy new year!||
47,h029976,Thanks,worldThe UN has been given the go-ahead to resume peacekeeping operations in Haiti following the ouster of former military dictator Jean-Bertrand Aristide.||
48,h0295z3,Why do I have to interaction with people why cant I hide?,||
49,h02954m,I am scared," to death of what's going to happen in Syria, but I'm terrified that it is not going to be a bloody civil war. The only question is whether it can be resolved peacefully or if violence erupts.||"
50,h0294kc,But I hate myself for myself as well," as my fellow students, but I am so happy to be a part of an effort that is helping people in need around the country.||"
51,h0293xg,Also,"worldBAGHDAD, Iraq - As the first US convoy arrived in Iraq, a senior official from the US Embassy in Baghdad confirmed to Al Jazeera  #39;The State Department will continue to support efforts by all parties to bring peace and security||"
52,h029354,"""Friends"" are overrated. I wish I could be more invisible at times. Its mainly my own fault. I'm too nice and generous and people take advantage. I have a few SOLID friends though but I've wasted alot of time and energy on people who just take.",||
53,h0292op,I wish for the panic to end," and the game to come to a sudden, complete end in an instant. I hope we can all agree on what is at stake tonight, and I hope everyone can agree on what must be done as quickly as possible||"
54,h029073,Same here. Im hesitating to call up a friend to catch up but at the same time I don't want to cause your exact reason.,||
55,h028olu,When strangers on the internet care more about you than people you know irl,", it's time to embrace your unique personality and share it with the world.||"
56,h028oa8,My kids. Pretty certain I wouldn't be here if I didn't have them. I pray they don't ever feel this way.,||
57,h028m87,Boooo,"oo! I have been a huge supporter of this game and the team for so long.  #39;I #39;ve been through some tough times with injuries, but this has been an outstanding year for the Eagles.||"
58,h028m3j,Have you been on a date since your break up?," If so, congratulations! It #39;s the perfect day to have a new partner and be together.||"
59,h0288kz,"Okay...here it goes....

The past and future are not real. Only memory, imagination and the choice of now. Use your memory to learn from the past to make the best choice for now to imagine a better future. 

And that’s what I tell myself. Also Keanu Reeves. When he said “you don’t have to be happy to live, I’m not”. I felt that. Now I just try to put as much professionalism into my work as he does.",
60,h0286qp,Sometimes I think in the moment that is a good enough moment to end my life on a high note and end my life feeling content.,||
