,comment_id,comments
0,g9jwlld,u/VredditDownloader
1,g9jtda8,You've started seeing Mudi in me now?
2,g9jt7gk,">""The State governments collect 23.4 per cent tax on the income of the temples including endowment administration tax (15 per cent), audit fee (2 per cent) and common good fund (2 per cent). That apart, money is also taken away from the temples for the Archaka Welfare Fund and other purposes.""  
  
>  
>But, such taxes and share in revenue is not collected from not a single church or mosque.  
>  
>In such a case, why should taxes and share in the revenue be collected only from Hindu temples?

[Source](https://www.newindianexpress.com/states/andhra-pradesh/2019/nov/25/priest-asks-why-governments-impose-taxes-only-on-hindu-temples-pawan-kalyan-shares-video-2066644.html) 

Even leftist(\*The print) media actually have realised this issue

>  
**One**, it is only for Hindu temples that the government wishes to ensure proper administration and its income used for ‘correct’ purposes.  
>  
>**Two**, contributions made to Hindu temples is used by the commissioner uses to fund various government programmes.  
>  
>**Three**, temple collections are not used to set up *ved pathshalas* and educational institutions for teaching Indian philosophy and tradition.  
>  
>**Four**, Subramaniam Swamy [wrote](https://www.thehindu.com/opinion/lead/freeing-temples-from-state-control/article5594132.ece), “The Srirangam Ranganathat Temple paid the government a fee of Rs 18.56 crore (2010-11) for ‘administering the temple’, for employees rendering religious services like reciting Vedas, Pasurams during the deity processions, no salary is paid. They get offerings made by devotees and share in sale of *archana* tickets”.  
>  
>**Five**, temple property has de-facto become pseudo-government property. According to T.R. Ramesh, President, Temple Worshippers Society Chennai – “Between 1986 and 2005 Tamil Nadu temples simply ‘lost’ 47,000 acres of land and currently more than 10 million square feet of valuable sites belonging to Hindu Temples in Tamil Nadu are under encroachment.”  
>  
>He adds, “In Tamil Nadu temples have over 478,000 plus acres of land, 2.44 cr sq feet of property for which the TN HR & CE department gets only Rs 58 crs p.a. In reality income from all temples, mutts would, on a conservative basis generate Rs 6,000 cr p.a.”  
>  
>**Six**, idols from ancient temples, part of India’s heritage, [go missing.](https://timesofindia.indiatimes.com/blogs/toi-edit-page/fence-that-eats-the-crop-government-running-hindu-temples-is-another-anomaly-indias-selective-secularism-fosters/) In any well-managed organisation, those responsible would be held accountable and punished, but not in the government.  
>  
>**Seven,** government interference has interrupted the ancient lineage of priesthood.  
>  
>**Eight**, when the government controls any institution, political interference, patronage and corruption invariably seep in.

[Source : The Print - Indian govt won’t be any different from British if Hindus can’t manage their own temples](https://theprint.in/opinion/indian-govt-wont-be-any-different-from-british-if-hindus-cant-manage-their-own-temples/218210/)  


[OpIndia :- Misusing funds from Temples and spending crores on Mosques and Churches is the hallmark of Nehruvian secularism](https://www.opindia.com/2020/02/free-hindu-temples-misuse-hindu-fund-spend-crores-mosques-church-secularism/)  
 \^\^ Above article indicates the taxation of temples and influx of taxpayer money to Non-Hindu orgs 

# Get your research right dipshit."
3,g9jsggh,From now on I should call you Jumla-e-feku
4,g9jq22b,"Aww commi here also! Happy to see a commi speaking atleast broken English! Buy hey, atleast we don't have your animal brain. Beef brain to be precise. And how's your Sapna doing. Hope you guys have idloised her. Lol! Only thing you know is barking admit that and get a life dude! Commis are worth shit these days!"
5,g9jp94n,"I'm from Kerala bro  now u shuthefup u obviously are a sanghi who believes the lies that come in your whatsapp groups... I've seen the senseless protests u r administering right now... Even the Congress is not as stupid as u r .. 
This whole drama is going to last until the election and then the central govt administered drama  will be over... Btw that sabarimala fail was epic u guys paying the petty  child molester activist to enter sabarimala and then protesting against it Sura de fail  aarn epic .. beef um kazich sabarimala kk ponn "
6,g9jp50r,"Dude, you cannot have a phobia of a majority community. Phobia of a community refers to discrimination or hate of a particular marginalised community. India is mostly Hindus, how can you have something called Hinduphobia?"
7,g9jowpj,"I made this Jumlaa just for you 

*A fools biggest folly is that he thinks everybody else is a fool*"
8,g9jneaz,"Honestly, her caste doesn't/didn't matter. She was a Hindu. That said, while I don't think her stupidity deserves death, I have no sympathy for women like her. She wasn't blind. She knew very well the kind of people Muslims are and yet she wanted to marry a Muslim. It's like me trying to play with fire and then complain that my hand got burnt. No shit Sherlock. If anything, I am glad her sacrifice probably showed a few Hindu girls and women what's in store for them and probably compelled them to reevaluate their choices. Let us hope a few more women die like this in the hands of their Muslim boyfriends - perhaps that will teach rest of them the challenges because dumb bitches don't seem to learn from others mistakes soon or early enough."
9,g9jm8p3,Bs ye jo chhote bachhe h na jinko smjh hi nhi aata ki news laundry kiska h or kyu h wo hi chutiye bde hoke secular bnte h
10,g9jm5zs,"Most of my state chose BJP coalition, I guess they are as chutiya as you are"
11,g9jkun2,What are they doing in Kerala!? Being a keralite I know what's happening more than you. CM and his assistant is directly involved in terrorist activities and you are saying BJP is doing this. Shut the fuck up dude.
12,g9jjzhc,Wasn't ghazi the title used by the Ottomans?
13,g9jjsay,"The point is that GST is not the point of concern here. It is what happens to the revenue of these institutions. While churches and mosques in India do not have to report their earnings to the all state governments, temples on the other hand do need to! Many states and all south indian states have endowement ministries which do exactly that. Infact, the government controls virtually everything temple related in these states (except karnataka I think). So, please do not divert the issue. Be truthful."
14,g9jjeml,">user reports:
1: This is misinformation

How and why?
Approved."
15,g9jfqv4,"They do tho. Yogi was recently slammed for the subsidy for hindu pilgrims in UP. Look it up, or a snub Liberandu will bait you with it into loosing an argument."
16,g9jfn8y,"Proud to be a keralite /s.

I was born and bought up in a muslim country and I can tell you, said Muslim country is a lot more liberal to other religions than my own damn state in India."
17,g9jex1h,"Only GST, but temples pay high income tax but mosques and churches don't. ~~Also they have subsidies on pilgrimage while  temples/hindus don't.~~

Edit: Everyone experience subsidies, from central govt."
18,g9jdvm0,Thats just GST. What about Income Tax?
19,g9jdv5u,Ha lol
20,g9jdr1s,"All institutions are taxed, calm down guys."
21,g9jdp37,"[who spread rumour churches and mosques are exempted from taxes](https://www.altnews.in/spread-rumour-churches-mosques-exempted-gst/)

[finance ministry slams rumours of churches and mosques being tax exempt](https://www.dnaindia.com/india/report-finance-ministry-slams-rumours-of-churches-and-mosques-being-exempt-from-paying-gst-2491112)"
22,g9jd3s5,Respect
23,g9jd1xy,Denial?
24,g9jccyu,It’s abominable that the government has control over and taxes Hindu temples in an 80% Hindu populated nation and levys no tax on mosques or churches. Absolute shitbaggery that blows my mind every day. If secularism is the fabric of our constitution then why is the religious majority the one always being shit on?
25,g9jc88w,Much respect to Sir J Sai Deepak!
26,g9j9df2,Against freedom of speech. Against nation.
27,g9j6ea2,Are you considering? Oh *please* don't do it!!
28,g9j6a4h,"If Arnab somehow grows a conscience, perhaps he would"
29,g9j65lq,Which state?
30,g9j4gam,Just like SSRINES<|endoftext|>
31,g9j494z,That pretty much explains what's going on in your state
32,g9j46j9,"Jaisa chutiya raja, waisi chutiya Praja"
33,g9j452a,"What here you go? 
Where is the statement about NRC that all will be given immunity except muslims? As you have said earlier."
34,g9j43pk,Next Bengal Kerala in the making<|endoftext|>
35,g9j3rrh,Karachi nai sambhal raha aur inhe Kashmir chaiye <|endoftext|>
36,g9j3fx0,"Don't care, would still vote for BJP again. Thank you!<|endoftext|>"
37,g9j2vke,"Don't care, would still vote for BJP again."
38,g9j1hcz,Karachi nai sambhal raha aur inhe Kashmir chaiye 
39,g9j1dtr,Next Bengal Kerala in the making
40,g9j1amq,Just like SSR
41,g9j0q7v,Hindu Devi Devtas should be kept out of such type of appropriation
42,g9j0j23,"Courtesy  - @upword_


"
43,g9j0a24,If skeletal remains of u/panditji_reloaded were to be found you would most probably find one of his hand touching the place where penis is located and the other hand holding a pic of KRK
44,g9j047i,After the battle of the ten kings several Indian tribes who lost moved north and westwards it could be them
45,g9iyhaf,Time for rajasthani Hindus to kick out congress next time.
46,g9iyd6z,"I more concerned about the yak, where is the yak?"
47,g9iy91m,"Suicide like that teacher in France. ???

He just fell on the knife and everyone is now blaming that DEENI MUSLMAN guy."
48,g9iwsrp,"Why senior most BJP leader @EknathGKhadse left the BJP?
1. Khadse was the chief minister aspirant & as a senior most BJP leader he claimed in CM post, but BJP chose his junior Devendra Fadnavis as CM in 2014 (1)

2. Khadse was forced to resign as a minister over Pune land and other issue. Khadse felt that there was deliberate conspiracy by erstwhile CM Devendra Fadnavis to cut to size him & destroy his 40 years political career. He expected central BJP leadership will help him but in vain

3. Khadse says injustice was done with him despite working for the BJP for 40 years & he waited for the justice patiently for last five years , but no one helped him. In 2019, Lok Sabha polls, he struggled to get ticket for his daughter in law.

4. In 2019, Khadse was denied ticket for state assembly election. His daughter Rohini Khadse lost the state polls by few number of votes. It was big set back to Khadse.

5. Khadse was promised MLC, then governor and nomination for Rajya Sabha but nothing was done. Khadse had huge hope from his past party but he was sidelined.

6. In home distinct of Khadse , BJP tried to make an alternative leadership through Girish Mahajan, Khadse's junior Mahajan was promoted on every forum while Khadse was systematically ignored that widened gap between Fadnavis and Khadse and it ended Khadse leaving BJP permanently"
49,g9iwnwe,"Indian Army always strives to set the right example, as I can see.  We do it as a matter of routine.  But such goodness is being wasted on the hostile  junta  who despises anything Indian, and is out to harm our country.  This is the irony of the situation."
50,g9iwavp,Bhai kab? 2011? Census aur registry me farak
51,g9ivpsf,Class
52,g9iu2u8,This idiotic party... Disgusting... They are just like communists.... They must perish... Congress mukt bharat!
53,g9itroo,"Half of the BJP MLAs are imports from Khangress party who joined so that they can get easy access to power on the back of Modi.

Now with UT snatching power under the feet of Cucknavis, there will be more desertions and BJP will reduce to a party of Gujjews and Naarth Endians."
54,g9ith5a,"yahoodi raaaa sazish, zenaab!<|endoftext|>I'm sure there are plenty of good guys in my circle of friends who share my values. But the way they have been treating you and your fellow colleagues at the National Council for Women is just as bad. Why do they care about such an insignificant group of people who can never even stand to work together with women?<|endoftext|>"
55,g9iruku,"yahoodi raaaa sazish, zenaab!<|endoftext|>"
56,g9irneq,"Yahoodi RAAAA sazish, zenaab!"
57,g9irlzw,"honestly, not calling out radical islam/islam is the biggest disservice to indian muslims ... islam needs to reform,the ""left"" can no longer make this a matter of debate - Their media channels have anyways delegitimized themselves before our very eyes. 

if we're tolerant with umar khalids , Swara bhaskars, terror sympathizers & separatists, we're basically letting terrorists speak for& mobilize all minorities. This oppression industry needs to end, the fake SJW left should no longer be acknowledged. We need to go the macron way & seriously take action on radical elements."
58,g9irgt1,Korean version. VPN also.
59,g9ir713,"I saw that video...Shah talks about CAA not NRC

Learn the difference then argue

LOL"
60,g9ir4qz,hehe boiii
61,g9ir2po,"> Shah's statement that NRC will be applied across the country, and that almost all people -- except Muslims will be given immunity.

What statement 

I can't recall any such statement from home minister"
62,g9iqlvb,"Allah must have told him, or was it Dawood?"
63,g9iougk,"bjp govt must release all funds illegally withheld by them asap. We stand with them, together with all the people of the country and we hope that our friends in Congress will support this noble act of justice.<|endoftext|>"
64,g9iopdp,BJP Govt must release all funds illegally withheld by them ASAP.
65,g9iokge,Should flare up more.
66,g9inbif,"
If you or someone you know is contemplating suicide, please reach out. You can find help at a National Suicide Prevention Lifeline

USA: 18002738255
US Crisis textline: 741741 text HOME

United Kingdom: 116 123

Trans Lifeline (877-565-8860)

Others: https://en.wikipedia.org/wiki/List_of_suicide_crisis_lines

"
67,g9imz5o,This seems more like a plan rather than corruption.
68,g9imabj,"NRC is done, the stats are out, and it’s not the Muslims who make the bulk of it, google it."
69,g9im6lt,Here you go: https://twitter.com/dillidurast/status/1207191726785323008?lang=en
70,g9ilt9g,They haven't been collected properly yet. Most are just estimates. A proper count would be called NRC.
71,g9ikb8d,"I mean if I got offended, and didn't speak out, that makes me a coward. 

The image was of Harris as durga, on Biden teh lion, killing trump the mahisasur. Our deities aren't meant for political carication, especially when someone abuses them."
72,g9ijv67,Good. They should keep going forward with this and disintegrate.
73,g9if695,I don’t see stats.
74,g9ie4t9,"Whenever I see such news , I feel pity on this being great mentality. An enemy is an enemy , and no one entres in other borders becuase his yak was lost ."
75,g9idzbr,We are already. We are taking the high road and following the laws of the land.
76,g9idx50,It also means they don't believe in nepotism.
77,g9i9k1p,Stats and also common sense.
78,g9i99h8,This is what happens when one joins BJP.... They force you to denounce your own family .... Like the Commies in China.
79,g9i7ahd,"This isn’t news, post to r/Chodi or r/IndiaSpeaks"
80,g9i6odq,Unfortunately He was wrong caste and religion to win any awards.
81,g9i5r4o,"The problem isn't what happens before marriage, it's what happens afterwards when one of them is coerced into following other's religion. Mostly women are made to convert and they try to change the demographics this way as well."
82,g9i4wpd,R/u/fartbaker13
83,g9i3dai,I believe there are many but fear backlash like mine removal
84,g9i27o0,As long as they are not forced into it. I really don't see the issue since it's a choice
85,g9i22yi,In the end they just conform to one religion anyway. Either the husband's or the wife's. So what's the point?
86,g9i22y5,In the end they just conform to one religion anyway. Either the husband's or the wife's. So what's the point?
87,g9i04kn,Bar is set low if we are following Islamists. We are better than that
88,g9hpoh4,"This.

Modi can't do anything unless he's sure that all of us would support him unconditionally, as long as he remains true to our cause.

Also, he needs to maintain good relations with Fasadi countries like Saudi for Oil, and Christian countries for other resources. He isn't a fucking autocrat."
89,g9hp5e9,The lefticle coward deluded himself into believing his ugly twisted comments would be popular here too after gaining a lot of karma in librandu
90,g9ho05m,Will the butthurt never stop.
91,g9hijjf,Seeking apology is having thick skin. People get beheaded for much less.
92,g9hifk3,"For one thing read the western press and understand their goals and motivations. 

Learn about media bias and how to create a compelling narrative. 

Have more people consider journalism as a career."
93,g9herjx,"Lol, kamlesh tiwari to chhoro, pahle yakub menon and bur han ke support mein mega rally to dekho."
94,g9h5qye,Why? Lol. Just because it is offensive? Or because it is Kamala? Look I dislike her but there's no reason to seek an apology. Grow thicker skin
95,g9h3l6v,“Most illegal immigrants are Bangladeshi Muslims”- really? What do you base this statement on?
96,g9h2sbb,"As an investment, ButtCoin, absolutely stinks."
97,g9h2ay7,"Abey motu, then you are fascist if you identify yourself as anyone and have a community based on your identity? Saala kaate kaate khudka damakbi khaaliya kya chutiye!"
98,g9jwlld,u/VredditDownloader
99,g9jtda8,You've started seeing Mudi in me now?
100,g9jt7gk,">""The State governments collect 23.4 per cent tax on the income of the temples including endowment administration tax (15 per cent), audit fee (2 per cent) and common good fund (2 per cent). That apart, money is also taken away from the temples for the Archaka Welfare Fund and other purposes.""  
  
>  
>But, such taxes and share in revenue is not collected from not a single church or mosque.  
>  
>In such a case, why should taxes and share in the revenue be collected only from Hindu temples?

[Source](https://www.newindianexpress.com/states/andhra-pradesh/2019/nov/25/priest-asks-why-governments-impose-taxes-only-on-hindu-temples-pawan-kalyan-shares-video-2066644.html) 

Even leftist(\*The print) media actually have realised this issue

>  
**One**, it is only for Hindu temples that the government wishes to ensure proper administration and its income used for ‘correct’ purposes.  
>  
>**Two**, contributions made to Hindu temples is used by the commissioner uses to fund various government programmes.  
>  
>**Three**, temple collections are not used to set up *ved pathshalas* and educational institutions for teaching Indian philosophy and tradition.  
>  
>**Four**, Subramaniam Swamy [wrote](https://www.thehindu.com/opinion/lead/freeing-temples-from-state-control/article5594132.ece), “The Srirangam Ranganathat Temple paid the government a fee of Rs 18.56 crore (2010-11) for ‘administering the temple’, for employees rendering religious services like reciting Vedas, Pasurams during the deity processions, no salary is paid. They get offerings made by devotees and share in sale of *archana* tickets”.  
>  
>**Five**, temple property has de-facto become pseudo-government property. According to T.R. Ramesh, President, Temple Worshippers Society Chennai – “Between 1986 and 2005 Tamil Nadu temples simply ‘lost’ 47,000 acres of land and currently more than 10 million square feet of valuable sites belonging to Hindu Temples in Tamil Nadu are under encroachment.”  
>  
>He adds, “In Tamil Nadu temples have over 478,000 plus acres of land, 2.44 cr sq feet of property for which the TN HR & CE department gets only Rs 58 crs p.a. In reality income from all temples, mutts would, on a conservative basis generate Rs 6,000 cr p.a.”  
>  
>**Six**, idols from ancient temples, part of India’s heritage, [go missing.](https://timesofindia.indiatimes.com/blogs/toi-edit-page/fence-that-eats-the-crop-government-running-hindu-temples-is-another-anomaly-indias-selective-secularism-fosters/) In any well-managed organisation, those responsible would be held accountable and punished, but not in the government.  
>  
>**Seven,** government interference has interrupted the ancient lineage of priesthood.  
>  
>**Eight**, when the government controls any institution, political interference, patronage and corruption invariably seep in.

[Source : The Print - Indian govt won’t be any different from British if Hindus can’t manage their own temples](https://theprint.in/opinion/indian-govt-wont-be-any-different-from-british-if-hindus-cant-manage-their-own-temples/218210/)  


[OpIndia :- Misusing funds from Temples and spending crores on Mosques and Churches is the hallmark of Nehruvian secularism](https://www.opindia.com/2020/02/free-hindu-temples-misuse-hindu-fund-spend-crores-mosques-church-secularism/)  
 \^\^ Above article indicates the taxation of temples and influx of taxpayer money to Non-Hindu orgs 

# Get your research right dipshit."
101,g9jsggh,From now on I should call you Jumla-e-feku
102,g9jq22b,"Aww commi here also! Happy to see a commi speaking atleast broken English! Buy hey, atleast we don't have your animal brain. Beef brain to be precise. And how's your Sapna doing. Hope you guys have idloised her. Lol! Only thing you know is barking admit that and get a life dude! Commis are worth shit these days!"
103,g9jp94n,"I'm from Kerala bro  now u shuthefup u obviously are a sanghi who believes the lies that come in your whatsapp groups... I've seen the senseless protests u r administering right now... Even the Congress is not as stupid as u r .. 
This whole drama is going to last until the election and then the central govt administered drama  will be over... Btw that sabarimala fail was epic u guys paying the petty  child molester activist to enter sabarimala and then protesting against it Sura de fail  aarn epic .. beef um kazich sabarimala kk ponn "
104,g9jp50r,"Dude, you cannot have a phobia of a majority community. Phobia of a community refers to discrimination or hate of a particular marginalised community. India is mostly Hindus, how can you have something called Hinduphobia?"
105,g9jowpj,"I made this Jumlaa just for you 

*A fools biggest folly is that he thinks everybody else is a fool*"
106,g9jneaz,"Honestly, her caste doesn't/didn't matter. She was a Hindu. That said, while I don't think her stupidity deserves death, I have no sympathy for women like her. She wasn't blind. She knew very well the kind of people Muslims are and yet she wanted to marry a Muslim. It's like me trying to play with fire and then complain that my hand got burnt. No shit Sherlock. If anything, I am glad her sacrifice probably showed a few Hindu girls and women what's in store for them and probably compelled them to reevaluate their choices. Let us hope a few more women die like this in the hands of their Muslim boyfriends - perhaps that will teach rest of them the challenges because dumb bitches don't seem to learn from others mistakes soon or early enough."
107,g9jm8p3,Bs ye jo chhote bachhe h na jinko smjh hi nhi aata ki news laundry kiska h or kyu h wo hi chutiye bde hoke secular bnte h
108,g9jm5zs,"Most of my state chose BJP coalition, I guess they are as chutiya as you are"
109,g9jkun2,What are they doing in Kerala!? Being a keralite I know what's happening more than you. CM and his assistant is directly involved in terrorist activities and you are saying BJP is doing this. Shut the fuck up dude.
110,g9jjzhc,Wasn't ghazi the title used by the Ottomans?
111,g9jjsay,"The point is that GST is not the point of concern here. It is what happens to the revenue of these institutions. While churches and mosques in India do not have to report their earnings to the all state governments, temples on the other hand do need to! Many states and all south indian states have endowement ministries which do exactly that. Infact, the government controls virtually everything temple related in these states (except karnataka I think). So, please do not divert the issue. Be truthful."
112,g9jjeml,">user reports:
1: This is misinformation

How and why?
Approved."
113,g9jfqv4,"They do tho. Yogi was recently slammed for the subsidy for hindu pilgrims in UP. Look it up, or a snub Liberandu will bait you with it into loosing an argument."
114,g9jfn8y,"Proud to be a keralite /s.

I was born and bought up in a muslim country and I can tell you, said Muslim country is a lot more liberal to other religions than my own damn state in India."
115,g9jex1h,"Only GST, but temples pay high income tax but mosques and churches don't. ~~Also they have subsidies on pilgrimage while  temples/hindus don't.~~

Edit: Everyone experience subsidies, from central govt."
116,g9jdvm0,Thats just GST. What about Income Tax?
117,g9jdv5u,Ha lol
118,g9jdr1s,"All institutions are taxed, calm down guys."
119,g9jdp37,"[who spread rumour churches and mosques are exempted from taxes](https://www.altnews.in/spread-rumour-churches-mosques-exempted-gst/)

[finance ministry slams rumours of churches and mosques being tax exempt](https://www.dnaindia.com/india/report-finance-ministry-slams-rumours-of-churches-and-mosques-being-exempt-from-paying-gst-2491112)"
120,g9jd3s5,Respect
121,g9jd1xy,Denial?
